id,joke
1,"Why did the marketer break up with the CRM? It kept sending mixed signals."
2,"How many martech vendors does it take to change a lightbulb? Just one, but they'll upsell you the smart bulb, the IoT hub, and a 12-month analytics subscription."
3,"A CDP, a DMP, and a MAP walk into a bar. The bartender says, 'We don't serve your kind here.' They say, 'That's okay, we'll just segment the audience and retarget you later.'"
4,"Why did the email marketer get therapy? Too many unresolved open issues."
5,"I asked our marketing automation platform to plan my vacation. It sent me a 7-step nurture sequence and a lead scoring model."
6,"What do you call a marketer who only uses vanity metrics? An influencer."
7,"Our A/B test came back inconclusive. We're now running an A/B/C/D/E/F test — we call it the 'alphabet campaign.'"
8,"Why don't martech stacks ever get lonely? Because they're always integrated."
9,"A customer walked into a store. The personalization engine showed them 47 ads for the shoes they already bought. Classic."
10,"What's a marketer's favorite horror movie? 'The Silence of the Churn.'"
11,"Why did the attribution model go to therapy? It had serious last-touch issues."
12,"Our marketing stack has 47 tools. We use 3 of them. The rest are on a 'strategic roadmap.'"
13,"What do you call a marketer obsessed with funnels? Someone who really needs to get out of the TOFU."
14,"I told our data team I needed customer insights. They sent me a dashboard with 200 metrics and the message: 'You figure it out.'"
15,"Why did the CMO cry at the board meeting? The ROI attribution model gave all the credit to direct traffic. Again."
16,"What's the difference between a martech vendor and a magician? The magician eventually reveals the trick."
17,"Our CDP unified the customer view so well, it now knows our customers better than they know themselves. Unfortunately, they still won't buy anything."
18,"Why did the programmatic ad get rejected? It failed the brand safety check for being too on-brand."
19,"A marketer died and went to heaven. St. Peter said, 'We have good news and bad news.' The marketer said, 'Tell me the bad news first.' St. Peter replied, 'Your email open rate was 12%.' The marketer said, 'What's the good news?' St. Peter said, 'Industry average is 11%.'"
20,"Why did the SEO specialist break up with the social media manager? There was no engagement."
